filename,accent_group,speaker_type,true_transcript,true_intent,duration
us_000.mp3,US,native,down below in the darkness were hundreds of people sleeping in peace,report_outage,0
us_001.mp3,US,native,down below in the darkness were hundreds of people sleeping in peace,report_outage,0
england_000.mp3,England,native,this was the strangest of all things that ever came to earth from outer space,unknown,0
us_002.mp3,US,native,it was glaringly hot not a cloud in the sky nor a breath of wind,unknown,0
england_001.mp3,England,native,i'm going away he said,unknown,0
england_002.mp3,England,native,some of the grey ash was falling off the circular edge,unknown,0
england_003.mp3,England,native,you'll take fifty and like it,unknown,0
african_000.mp3,African,ESL,if i had told you you wouldn't have seen the pyramids,unknown,0
india_000.mp3,India,ESL,i told him we could teach her to ignore people who waste her time,unknown,0
us_003.mp3,US,native,henderson stood up with a spade in his hand,unknown,0
us_004.mp3,US,native,he didn't need to seek out the old woman for this,unknown,0
canadian_000.mp3,Canadian,native,only a minority of literature is written this way,unknown,0
us_005.mp3,US,native,i wish you wouldn't,unknown,0
us_006.mp3,US,native,don't do it for me,unknown,0
england_004.mp3,England,native,i'm not working for any other paper,report_outage,0
us_007.mp3,US,native,now i will drift gently off to dreamland,unknown,0
canadian_001.mp3,Canadian,native,he did find it soon after dawn and not far from the sand pits,unknown,0
us_008.mp3,US,native,shakespeare never said that,unknown,0
us_009.mp3,US,native,frank was dying so they were forced to leave him,unknown,0
us_010.mp3,US,native,the boy reminded the old man that he had said something about hidden treasure,unknown,0
india_001.mp3,India,ESL,don't point the gun at me,unknown,0
england_005.mp3,England,native,he's the man the ads are written for,unknown,0
england_006.mp3,England,native,there was no excuse for goodman to fly off the handle,unknown,0
us_011.mp3,US,native,i told you to have the ice box fixed,unknown,0
india_002.mp3,India,ESL,but finally the merchant appeared and asked the boy to shear four sheep,unknown,0
england_007.mp3,England,native,most meteorites are more or less rounded,unknown,0
canadian_002.mp3,Canadian,native,it's candice now on long distance from washington,unknown,0
england_008.mp3,England,native,he could always go back to being a shepherd,unknown,0
us_012.mp3,US,native,do you know what,unknown,0
england_009.mp3,England,native,their faces were hidden behind blue veils with only their eyes showing,unknown,0
england_010.mp3,England,native,he remembered something his grandfather had once told him that butterflies were a good omen,unknown,0
us_013.mp3,US,native,even then he hardly understood what this meant,unknown,0
india_003.mp3,India,ESL,after the dictator's rule of fourty three years was over the country was devastated,unknown,0
england_011.mp3,England,native,all they ever do really is look for food and water,unknown,0
canadian_003.mp3,Canadian,native,sure you don't want me to go in with you,unknown,0
us_014.mp3,US,native,i want it as soon as possible,unknown,0
us_015.mp3,US,native,modern sewing machines can throttle their speed,unknown,0
us_016.mp3,US,native,it's as much my fault as yours,unknown,0
us_017.mp3,US,native,you don't deny that,unknown,0
us_018.mp3,US,native,then he sat in the sunfilled doorway smoking the hookah,unknown,0
us_019.mp3,US,native,about eleven i walked back to my home in maybury because nothing seemed to be happening,unknown,0
canadian_004.mp3,Canadian,native,from here on you will be alone the alchemist said,unknown,0
india_004.mp3,India,ESL,on our way to san francisco we were listening to reggae music and smoking weed,unknown,0
india_005.mp3,India,ESL,work for somebody else,unknown,0
england_012.mp3,England,native,this is no place for you,unknown,0
england_013.mp3,England,native,it was the first time either had touched the other,unknown,0
england_014.mp3,England,native,then connect to localhost within windows,unknown,0
england_015.mp3,England,native,don't give in to your fears said the alchemist in a strangely gentle voice,unknown,0
canadian_005.mp3,Canadian,native,just handling them made him feel better,unknown,0
england_016.mp3,England,native,in one he had read that many years ago a famous arabian alchemist had visited europe,unknown,0
england_017.mp3,England,native,i'd hate to have that many pins stuck in me,unknown,0
england_018.mp3,England,native,apparently it's the dumplings that make this stew taste so good,unknown,0
canadian_006.mp3,Canadian,native,and their eyes spoke of death,unknown,0
england_019.mp3,England,native,the alchemist is two hundred years old the englishman had told him,unknown,0
india_006.mp3,India,ESL,his hands began to tremble and the woman sensed it,unknown,0
canadian_007.mp3,Canadian,native,sadly my dream of becoming a squirrel whisperer may never happen,unknown,0
india_007.mp3,India,ESL,they were strange books,unknown,0
canadian_008.mp3,Canadian,native,then you taught me something of the universal language and the soul of the world,unknown,0
canadian_009.mp3,Canadian,native,i need you to be spontaneous he asked me out to din din,unknown,0
india_008.mp3,India,ESL,the cottage burned down,report_outage,0
canadian_010.mp3,Canadian,native,i should thank you,unknown,0
canadian_011.mp3,Canadian,native,the stranger placed his sword in its scabbard and the boy relaxed,unknown,0
india_009.mp3,India,ESL,another who was searching the boy's bags found the piece of gold,unknown,0
india_010.mp3,India,ESL,it was rising slowly and painfully out of the cylinder,unknown,0
india_011.mp3,India,ESL,i didn't find the blowdryer so i just used the vacuumcleaner,unknown,0
canadian_012.mp3,Canadian,native,what's all this mess,unknown,0
canadian_013.mp3,Canadian,native,is winged victory showing anywhere in one minute,unknown,0
canadian_014.mp3,Canadian,native,where was his horse,unknown,0
african_001.mp3,African,ESL,he decided to spend the night there,unknown,0
india_012.mp3,India,ESL,where do you live,unknown,0
canadian_015.mp3,Canadian,native,i should have been there,unknown,0
india_013.mp3,India,ESL,so he asked if the old man's blessing was still with him,unknown,0
canadian_016.mp3,Canadian,native,then he realized that he had been distracted for a few moments looking at the sword,unknown,0
india_014.mp3,India,ESL,he is going to transform himself into the wind just to demonstrate his powers,pay_bill,0
canadian_017.mp3,Canadian,native,it's a private club for only the most respectable people,unknown,0
india_015.mp3,India,ESL,are you sure this is claire,unknown,0
canadian_018.mp3,Canadian,native,go and speak to the tribal chieftains said the camel driver,unknown,0
canadian_019.mp3,Canadian,native,he's doing it because it's what he wants to do,unknown,0
india_016.mp3,India,ESL,if he abandons that pursuit it's because it wasn't truelove,unknown,0
african_002.mp3,African,ESL,the guy thought he was a lunatic at large and made an unsuccessful attempt to stop him,unknown,0
india_017.mp3,India,ESL,it's just that i never have,unknown,0
india_018.mp3,India,ESL,come on in here now,unknown,0
india_019.mp3,India,ESL,the ladder of the fire truck was not long enough,unknown,0
african_003.mp3,African,ESL,fatima appeared at the entrance to the tent,unknown,0
african_004.mp3,African,ESL,absolutely despicable that gingerbread men are forced to live in houses made of their own flesh,unknown,0
african_005.mp3,African,ESL,i'm going into the desert the man answered turning back to his reading,unknown,0
african_006.mp3,African,ESL,an huge hole had been made by the impact of the projectile,unknown,0
african_007.mp3,African,ESL,that he wanted to travel,unknown,0
african_008.mp3,African,ESL,there was a murmur from the crowd,unknown,0
african_009.mp3,African,ESL,but he kept quiet because he had heard what the alchemist said to the monk,unknown,0
african_010.mp3,African,ESL,with the girl with the raven hair his days would never be the same again,unknown,0
african_011.mp3,African,ESL,i have no information about troops or about the movement of the tribes,account_info,0
african_012.mp3,African,ESL,it was starlight and i explained the signs of the zodiac to her,unknown,0
african_013.mp3,African,ESL,the nearby city of ceuta had grown faster than tangier and business had fallen off,unknown,0
african_014.mp3,African,ESL,can i help you asked the man behind the window,unknown,0
african_015.mp3,African,ESL,yeah better if people are already familiar with one and are thinking of switching to the other,unknown,0
african_016.mp3,African,ESL,you came so that you could learn about your dreams said the old woman,unknown,0
african_017.mp3,African,ESL,even the guides spoke very little to one another,unknown,0
african_018.mp3,African,ESL,i gotta figure some way out of this thing,unknown,0
african_019.mp3,African,ESL,but we could sell tea in crystal glasses,unknown,0
